{
  "schema_version": 1,
  "id": "lumen",
  "display_name": "Lumen",
  "scene_path": "res://scenes/characters/placeholder.tscn",
  "scale": [
    1,
    1,
    1
  ],
  "forward_axis": "-Z",
  "collision": {
    "radius": 0.27,
    "height": 1.1
  },
  "navigation": {
    "radius": 0.3,
    "speed": 2.5
  },
  "rig": {
    "skeleton_path": "",
    "animation_player_path": "",
    "notes": "Procedural visual scene exposes set_action(action). Imported rig scenes may map semantic names to AnimationPlayer clips. Visual root stands at y=0; engine owns movement/collision."
  },
  "animations": {
    "idle": "idle",
    "walk": "walk",
    "interact": "interact",
    "work": "work",
    "phone": "phone"
  },
  "fallbacks": {
    "sit": "idle",
    "read": "interact",
    "garden": "interact",
    "observe": "interact",
    "music": "interact"
  },
  "appearance": {
    "color": "#c89f60",
    "accent": "#f4cb80"
  },
  "metadata": {
    "creator": "Domes for Dots contributors",
    "license": "MIT",
    "variant": "lantern_keeper",
    "representation": "Chosen simple mote visual; replaceable through the character contract"
  }
}
